{
  "title": "Review JobRouter security",
  "description": "Perform a security review of the JobRouter contract focusing on the state machine transitions, escrow accounting, and settlement math.",
  "requirements": [
    "Solidity security auditing experience",
    "Familiarity with ERC-20 safe transfer patterns",
    "Understanding of reentrancy and access control"
  ],
  "deliverables": [
    "Security review document with findings",
    "Critical/high issues filed as GitHub issues"
  ],
  "payment": "150 USDC",
  "deadline": "2026-09-17",
  "context": "JobRouter is the core state machine: createJob → accept → submitResult → approve/expire/cancel. It holds USDC in escrow and distributes via ValueSplit. Key areas: invariant I7 (escrow conservation), access control on each transition, edge cases around deadline handling, and the mutual cancel flow."
}
